{"arms":[{"engine":"vLLM","line_style":"solid","marker":"circle","points":[{"active_sessions":24,"level_valid":true,"readings":{"cache_context":{"available":false,"evidence_state":"unavailable","reason":"Not available with a comparable public definition.","unit":"%","value":null},"decode_p10_tps":{"available":true,"evidence_state":"threshold_met","reason":null,"unit":"tok/s","value":21.647357597927805},"error_rate_pct":{"available":true,"evidence_state":"measured","reason":null,"unit":"%","value":0.1557632398753894},"gpu_memory_gib":{"available":true,"evidence_state":"measured","reason":null,"unit":"GiB","value":133.58978271484375},"gpu_power_w":{"available":true,"evidence_state":"measured","reason":null,"unit":"W","value":591.2128666666667},"gpu_utilization_pct":{"available":true,"evidence_state":"measured","reason":null,"unit":"%","value":100.0},"output_tps":{"available":true,"evidence_state":"measured","reason":null,"unit":"tok/s","value":374.7588238735019},"running_requests_mean":{"available":true,"evidence_state":"measured","reason":null,"unit":"requests","value":15.533333333333333},"tpot_p50_ms":{"available":true,"evidence_state":"measured","reason":null,"unit":"ms/token","value":36.749324468085106},"ttft_p50_ms":{"available":true,"evidence_state":"measured","reason":null,"unit":"ms","value":2327.0245},"ttft_p95_ms":{"available":true,"evidence_state":"measured","reason":null,"unit":"ms","value":14548.081291},"waiting_requests_mean":{"available":true,"evidence_state":"measured","reason":null,"unit":"requests","value":0.03333333333333333}},"total_requests":642,"users":12,"valid_requests":641},{"active_sessions":32,"level_valid":true,"readings":{"cache_context":{"available":false,"evidence_state":"unavailable","reason":"Not available with a comparable public definition.","unit":"%","value":null},"decode_p10_tps":{"available":true,"evidence_state":"threshold_missed","reason":null,"unit":"tok/s","value":15.959221959779452},"error_rate_pct":{"available":true,"evidence_state":"measured","reason":null,"unit":"%","value":0.15015015015015015},"gpu_memory_gib":{"available":true,"evidence_state":"measured","reason":null,"unit":"GiB","value":133.58978271484375},"gpu_power_w":{"available":true,"evidence_state":"measured","reason":null,"unit":"W","value":600.8785833333333},"gpu_utilization_pct":{"available":true,"evidence_state":"measured","reason":null,"unit":"%","value":99.91666666666667},"output_tps":{"available":true,"evidence_state":"measured","reason":null,"unit":"tok/s","value":376.7270594950265},"running_requests_mean":{"available":true,"evidence_state":"measured","reason":null,"unit":"requests","value":23.266666666666666},"tpot_p50_ms":{"available":true,"evidence_state":"measured","reason":null,"unit":"ms/token","value":49.54259679797979},"ttft_p50_ms":{"available":true,"evidence_state":"measured","reason":null,"unit":"ms","value":2789.812041},"ttft_p95_ms":{"available":true,"evidence_state":"measured","reason":null,"unit":"ms","value":17179.270167},"waiting_requests_mean":{"available":true,"evidence_state":"measured","reason":null,"unit":"requests","value":0.03333333333333333}},"total_requests":666,"users":16,"valid_requests":665},{"active_sessions":48,"level_valid":true,"readings":{"cache_context":{"available":false,"evidence_state":"unavailable","reason":"Not available with a comparable public definition.","unit":"%","value":null},"decode_p10_tps":{"available":true,"evidence_state":"threshold_missed","reason":null,"unit":"tok/s","value":9.581166807869453},"error_rate_pct":{"available":true,"evidence_state":"measured","reason":null,"unit":"%","value":0.0},"gpu_memory_gib":{"available":true,"evidence_state":"measured","reason":null,"unit":"GiB","value":133.58978271484375},"gpu_power_w":{"available":true,"evidence_state":"measured","reason":null,"unit":"W","value":629.8228833333334},"gpu_utilization_pct":{"available":true,"evidence_state":"measured","reason":null,"unit":"%","value":100.0},"output_tps":{"available":true,"evidence_state":"measured","reason":null,"unit":"tok/s","value":379.4803156121838},"running_requests_mean":{"available":true,"evidence_state":"measured","reason":null,"unit":"requests","value":36.61666666666667},"tpot_p50_ms":{"available":true,"evidence_state":"measured","reason":null,"unit":"ms/token","value":74.48276938613861},"ttft_p50_ms":{"available":true,"evidence_state":"measured","reason":null,"unit":"ms","value":5455.011208},"ttft_p95_ms":{"available":true,"evidence_state":"measured","reason":null,"unit":"ms","value":30787.455542},"waiting_requests_mean":{"available":true,"evidence_state":"measured","reason":null,"unit":"requests","value":0.2}},"total_requests":662,"users":24,"valid_requests":662}]},{"engine":"SGLang","line_style":"dashed","marker":"diamond","points":[{"active_sessions":24,"level_valid":true,"readings":{"cache_context":{"available":false,"evidence_state":"unavailable","reason":"Not available with a comparable public definition.","unit":"%","value":null},"decode_p10_tps":{"available":true,"evidence_state":"threshold_met","reason":null,"unit":"tok/s","value":33.005161580540744},"error_rate_pct":{"available":true,"evidence_state":"measured","reason":null,"unit":"%","value":0.0},"gpu_memory_gib":{"available":true,"evidence_state":"measured","reason":null,"unit":"GiB","value":125.672119140625},"gpu_power_w":{"available":true,"evidence_state":"measured","reason":null,"unit":"W","value":671.2198666666667},"gpu_utilization_pct":{"available":true,"evidence_state":"measured","reason":null,"unit":"%","value":98.86666666666666},"output_tps":{"available":true,"evidence_state":"measured","reason":null,"unit":"tok/s","value":497.36994127360805},"running_requests_mean":{"available":true,"evidence_state":"measured","reason":null,"unit":"requests","value":13.716666666666667},"tpot_p50_ms":{"available":true,"evidence_state":"measured","reason":null,"unit":"ms/token","value":20.63596386725664},"ttft_p50_ms":{"available":true,"evidence_state":"measured","reason":null,"unit":"ms","value":1667.396959},"ttft_p95_ms":{"available":true,"evidence_state":"measured","reason":null,"unit":"ms","value":8229.3205},"waiting_requests_mean":{"available":true,"evidence_state":"measured","reason":null,"unit":"requests","value":0.05}},"total_requests":747,"users":12,"valid_requests":747},{"active_sessions":32,"level_valid":true,"readings":{"cache_context":{"available":false,"evidence_state":"unavailable","reason":"Not available with a comparable public definition.","unit":"%","value":null},"decode_p10_tps":{"available":true,"evidence_state":"threshold_missed","reason":null,"unit":"tok/s","value":17.482769989167465},"error_rate_pct":{"available":true,"evidence_state":"measured","reason":null,"unit":"%","value":0.0},"gpu_memory_gib":{"available":true,"evidence_state":"measured","reason":null,"unit":"GiB","value":125.672119140625},"gpu_power_w":{"available":true,"evidence_state":"measured","reason":null,"unit":"W","value":682.3903999999999},"gpu_utilization_pct":{"available":true,"evidence_state":"measured","reason":null,"unit":"%","value":97.73333333333333},"output_tps":{"available":true,"evidence_state":"measured","reason":null,"unit":"tok/s","value":480.43621543584874},"running_requests_mean":{"available":true,"evidence_state":"measured","reason":null,"unit":"requests","value":19.05},"tpot_p50_ms":{"available":true,"evidence_state":"measured","reason":null,"unit":"ms/token","value":27.706553358574613},"ttft_p50_ms":{"available":true,"evidence_state":"measured","reason":null,"unit":"ms","value":2041.941292},"ttft_p95_ms":{"available":true,"evidence_state":"measured","reason":null,"unit":"ms","value":9764.01125},"waiting_requests_mean":{"available":true,"evidence_state":"measured","reason":null,"unit":"requests","value":0.5833333333333334}},"total_requests":889,"users":16,"valid_requests":889},{"active_sessions":48,"level_valid":true,"readings":{"cache_context":{"available":false,"evidence_state":"unavailable","reason":"Not available with a comparable public definition.","unit":"%","value":null},"decode_p10_tps":{"available":true,"evidence_state":"threshold_missed","reason":null,"unit":"tok/s","value":8.162312232411331},"error_rate_pct":{"available":true,"evidence_state":"measured","reason":null,"unit":"%","value":0.0},"gpu_memory_gib":{"available":true,"evidence_state":"measured","reason":null,"unit":"GiB","value":125.676025390625},"gpu_power_w":{"available":true,"evidence_state":"measured","reason":null,"unit":"W","value":692.1702000000001},"gpu_utilization_pct":{"available":true,"evidence_state":"measured","reason":null,"unit":"%","value":99.26666666666667},"output_tps":{"available":true,"evidence_state":"measured","reason":null,"unit":"tok/s","value":365.3459253216277},"running_requests_mean":{"available":true,"evidence_state":"measured","reason":null,"unit":"requests","value":34.516666666666666},"tpot_p50_ms":{"available":true,"evidence_state":"measured","reason":null,"unit":"ms/token","value":68.29774684126984},"ttft_p50_ms":{"available":true,"evidence_state":"measured","reason":null,"unit":"ms","value":5451.441167},"ttft_p95_ms":{"available":true,"evidence_state":"measured","reason":null,"unit":"ms","value":30014.645167},"waiting_requests_mean":{"available":true,"evidence_state":"measured","reason":null,"unit":"requests","value":1.2}},"total_requests":601,"users":24,"valid_requests":601}]}],"levels":[12,16,24],"limitations":["Capacity was not established under the declared service objectives.","This is a recorded deployment comparison, not an engine-only benchmark.","TTFT is reported for experience analysis but is not a capacity gate.","Runtime-native cache gauges use incompatible definitions and are not ranked."],"methodology":{"capacity_state":"not_established","decode_threshold_tps":20.0,"measurement_seconds":300,"sessions_per_user":2,"ttft_gated":false,"warmup_seconds":120},"metric_definitions":[{"direction":"higher","explanation":"Successful output tokens per measured second.","id":"output_tps","